{
  "schema_version": "1.0.0",
  "sample_id": "sample-5h-001",
  "meter_type": "five_hour",
  "sampled_at": "2026-10-01T02:00:00Z",
  "used_percent": {
    "availability": "available",
    "value": 20,
    "provenance": "observed"
  },
  "remaining_percent": {
    "availability": "unavailable",
    "provenance": "unavailable"
  },
  "reset_evidence": {
    "availability": "available",
    "meter_type": "five_hour",
    "local_window_id": "local-window-5h-01",
    "observed_reset_at": "2026-10-01T05:00:00Z",
    "evidence_first_sample_at": "2026-10-01T02:00:00Z",
    "evidence_last_sample_at": "2026-10-01T02:00:00Z",
    "identity_provenance": "observed_reset",
    "identity_confidence": "high"
  },
  "configuration": {
    "plan": {
      "availability": "available",
      "value": "plus",
      "provenance": "observed"
    },
    "model": {
      "availability": "available",
      "value": "gpt-5.6-sol",
      "provenance": "observed"
    },
    "reasoning_level": {
      "availability": "available",
      "value": "high",
      "provenance": "observed"
    },
    "speed_mode": {
      "availability": "unavailable",
      "provenance": "unavailable"
    },
    "codex_version": {
      "availability": "unavailable",
      "provenance": "unavailable"
    }
  },
  "acquisition_status": "partial",
  "source_kind": "local_meter"
}
